{
  "schema_version": 2,
  "spec_id": "m15-search-work-calibration-v1",
  "budget_mode": "calibrated_grid",
  "reference_environment_specification": {
    "python": "3.14",
    "platform": "ubuntu-24.04",
    "runtime_profile": "offline_m15_calibration"
  },
  "calibration_state_construction_rule": "Use the versioned synthetic calibration-state construction for the applicable Search implementation; do not inspect action quality or battle outcomes.",
  "ordered_work_grid": [64, 128, 256, 512],
  "selection_rule_id": "largest-value-under-runtime-limit-v1",
  "measurement_profile_id": "m15-runtime-only-v1",
  "selection_measurement_id": "wall_time_ms",
  "required_measurement_ids": ["wall_time_ms", "cpu_time_ms"],
  "runtime_limit_ms": 2000.0,
  "allowed_runtime_measurements": ["wall_time_ms", "cpu_time_ms", "peak_memory_bytes"],
  "forbidden_quality_measurements": [
    "decision_regret_teacher_v1",
    "battle_outcome_weighted_v1",
    "teacher_top1_agreement_v1",
    "selection_holdout_score",
    "release_holdout_score"
  ]
}
